{
  "world_truth_track_version": 2,
  "producer": {
    "tool": "unknown",
    "tool_version": null,
    "carlanet": "0.10.0\u002Bg252f459d0",
    "server": null,
    "sumo": "1.27.0",
    "written_utc": "2026-10-08T03:30:43.040Z"
  },
  "track": "world_truth_track.csv",
  "columns": [
    "time_utc",
    "sim_time_s",
    "uid",
    "callsign",
    "cot_type",
    "how",
    "lat",
    "lon",
    "hae_m",
    "ce_m",
    "le_m",
    "course_deg",
    "speed_mps",
    "vx",
    "vy",
    "vz",
    "base_type",
    "type_id",
    "special_type",
    "length_m",
    "width_m",
    "height_m",
    "color",
    "role_name",
    "edge",
    "lane",
    "sumo_x",
    "sumo_y",
    "carla_x",
    "carla_y",
    "sumo_id",
    "entity_id",
    "frame",
    "render_state",
    "render_reason",
    "actor_id",
    "in_window",
    "sun_elevation_deg",
    "sun_corrected_elevation_deg",
    "illumination_band",
    "illumination_band_elevation"
  ],
  "instant": "traci_clock",
  "sumo_step_s": 1,
  "interval_s": 1,
  "every_sumo_steps": 1,
  "outside_window_interval_s": null,
  "samples": 34,
  "rows": 116,
  "first_sample_s": 0,
  "last_sample_s": 33,
  "ended": {
    "reason": "scenario_finished",
    "last_sumo_frame_s": 35,
    "last_rendered_s": 33.95000000000021,
    "last_rendered_frame": 680
  }
}
