{
  "world_truth_track_version": 2,
  "track": "world_truth_track.csv",
  "columns": [
    "time_utc",
    "sim_time_s",
    "uid",
    "callsign",
    "cot_type",
    "how",
    "lat",
    "lon",
    "hae_m",
    "ce_m",
    "le_m",
    "course_deg",
    "speed_mps",
    "vx",
    "vy",
    "vz",
    "base_type",
    "type_id",
    "special_type",
    "length_m",
    "width_m",
    "height_m",
    "color",
    "role_name",
    "edge",
    "lane",
    "sumo_x",
    "sumo_y",
    "carla_x",
    "carla_y",
    "sumo_id",
    "entity_id",
    "frame",
    "render_state",
    "render_reason",
    "actor_id",
    "in_window",
    "sun_elevation_deg",
    "sun_corrected_elevation_deg",
    "illumination_band",
    "illumination_band_elevation"
  ],
  "instant": "traci_clock",
  "sumo_step_s": 0.05,
  "interval_s": 0.05,
  "every_sumo_steps": 1,
  "outside_window_interval_s": null,
  "samples": 3600,
  "rows": 180125,
  "first_sample_s": 60,
  "last_sample_s": 239.95,
  "ended": {
    "reason": "caller_stopped",
    "last_sumo_frame_s": 240.05,
    "last_rendered_s": 239.9500000000203,
    "last_rendered_frame": 27273
  }
}
